{
  "$schema": "http://json-schema.org/draft-07/schema#",
  "title": "CORE Business Event Envelope v1",
  "description": "Schema for a domain-neutral business event envelope derived from a state watcher. CORE validates the envelope; the fork interprets the payload.",
  "type": "object",
  "required": ["event_id", "event_type", "source_watcher_id", "timestamp", "fingerprint", "payload"],
  "additionalProperties": false,
  "properties": {
    "event_id": {
      "type": "string",
      "description": "Unique event identifier."
    },
    "event_type": {
      "type": "string",
      "description": "Type of business event, matching the watcher's declared event_type."
    },
    "source_watcher_id": {
      "type": "string",
      "description": "The watcher_id that produced this event."
    },
    "timestamp": {
      "type": "string",
      "format": "date-time",
      "description": "ISO-8601 timestamp of the observation that triggered this event."
    },
    "fingerprint": {
      "type": "string",
      "pattern": "^[a-f0-9]{64}$",
      "description": "SHA-256 fingerprint of the event envelope for replay certification."
    },
    "payload": {
      "type": "object",
      "additionalProperties": true,
      "description": "Opaque domain-specific payload. CORE never interprets these fields."
    },
    "previous_value": {
      "type": "number",
      "description": "Previous observation value before the triggering observation."
    },
    "threshold_value": {
      "type": "number",
      "description": "Threshold value that was crossed."
    },
    "observation_fixture_id": {
      "type": "string",
      "description": "Fixture ID of the observation source."
    }
  }
}
