{
  "event_id": "evt_synthetic.threshold_exceeded_obs_004",
  "event_type": "threshold_exceeded",
  "source_watcher_id": "synthetic.threshold_exceeded",
  "timestamp": "2026-06-01T11:00:00Z",
  "fingerprint": "7ce1e9e996e93657e6f1a41523d331122c7cda2a7b28bc0033676a1285df66a7",
  "payload": {
    "operand_value": 150.0,
    "threshold_value": 100.0,
    "observation_id": "obs_004"
  }
}
